<?xml version="1.0" encoding="UTF-8" ?>
<environment xmlns="http://drivebuild.com"
             xmlns:xsi="http://www.w3.org/2001/XMLSchema-instance"
             xsi:schemaLocation="http://drivebuild.com ../drivebuild.xsd">
    <author>Stefan Huber</author>

    <lanes>
        <lane>
            <laneSegment x="0" y="0" width="5"/>
            <laneSegment x="50" y="0" width="5"/>
            <laneSegment x="80" y="20" width="5"/>
            <laneSegment x="100" y="20" width="5"/>
        </lane>
    </lanes>

    <obstacles>
        <cone x="5" y="5" height="5" baseRadius="1"/>
    </obstacles>
</environment>