<?xml version='1.0' encoding='utf-8'?>
<environment xmlns="http://drivebuild.com" xmlns:xsi="http://www.w3.org/2001/XMLSchema-instance" xsi:schemaLocation="http://drivebuild.com drivebuild.xsd">
    <author>Stefan Huber</author>
    <timeOfDay>0</timeOfDay>
    <lanes>
        <lane markings="true">
            <laneSegment x="1.0" y="0.0" width="6" />
            <laneSegment x="7.928566676731771" y="2.6178515585789097" width="6" />
            <laneSegment x="11.976848269440552" y="7.49703112152404" width="6" />
            <laneSegment x="15.382297729992136" y="11.978168092945944" width="6" />
            <laneSegment x="19.070698211623846" y="15.197714000309226" width="6" />
            <laneSegment x="23.171205738178067" y="17.329079864496645" width="6" />
            <laneSegment x="27.5158261691661" y="18.847999420243458" width="6" />
            <laneSegment x="31.95515089768804" y="20.083860025291155" width="6" />
            <laneSegment x="36.40169682461469" y="21.194979571139566" width="6" />
            <laneSegment x="40.81239735394379" y="22.238586353598137" width="6" />
            <laneSegment x="45.17027663344325" y="23.24202546502637" width="6" />
            <laneSegment x="49.46759163999391" y="24.264927221460148" width="6" />
            <laneSegment x="53.69786831960522" y="25.40661219691853" width="6" />
            <laneSegment x="57.85574094513917" y="26.76544947901431" width="6" />
            <laneSegment x="61.93772522365379" y="28.392465544883198" width="6" />
            <laneSegment x="65.94297954012498" y="30.24543164898076" width="6" />
            <laneSegment x="69.87347478214923" y="32.16352030351826" width="6" />
            <laneSegment x="73.73218045507424" y="33.91095363206991" width="6" />
            <laneSegment x="77.52022552897323" y="35.256309750741494" width="6" />
            <laneSegment x="81.23399960405831" y="36.053904864964565" width="6" />
            <laneSegment x="84.86237790197565" y="36.32209543353761" width="6" />
            <laneSegment x="88.38607335564511" y="36.26867250125736" width="6" />
            <laneSegment x="91.78110425240054" y="36.21388888888889" width="6" />
            <laneSegment x="95.02348887957591" y="36.48296685751948" width="6" />
            <laneSegment x="98.09396904293257" y="37.297899940598526" width="6" />
            <laneSegment x="100.98252375371146" y="38.679473563951014" width="6" />
            <laneSegment x="103.69112938361617" y="40.43468267756163" width="6" />
            <laneSegment x="106.23452115582435" y="42.24148432277147" width="6" />
            <laneSegment x="108.64062478325778" y="43.74961402798059" width="6" />
            <laneSegment x="110.95096197109012" y="44.68125220436652" width="6" />
            <laneSegment x="113.21929218073778" y="44.912828338021285" width="6" />
            <laneSegment x="115.50235886562668" y="44.472386894134424" width="6" />
            <laneSegment x="117.84530987312856" y="43.479996387157776" width="6" />
            <laneSegment x="120.26666666666667" y="42.083333333333336" width="6" />
            <laneSegment x="122.7435617136471" y="40.39412965309092" width="6" />
            <laneSegment x="125.20395456273219" y="38.44713797772091" width="6" />
            <laneSegment x="127.53656305559522" y="36.21625778997542" width="6" />
            <laneSegment x="129.60777322801727" y="33.6531794689443" width="6" />
            <laneSegment x="131.27881757441403" y="30.72689352917277" width="6" />
            <laneSegment x="132.42286558295197" y="27.461583132051324" width="6" />
            <laneSegment x="132.9410786918634" y="23.955432359313907" width="6" />
            <laneSegment x="132.77713000416273" y="20.37114217706548" width="6" />
            <laneSegment x="131.93138105320676" y="16.92012633679185" width="6" />
            <laneSegment x="130.47502033112755" y="13.846605737207412" width="6" />
            <laneSegment x="128.55912208504802" y="11.409327846364878" width="6" />
            <laneSegment x="126.39292568813605" y="9.848895743170385" width="6" />
            <laneSegment x="124.195110616793" y="9.342471727999937" width="6" />
            <laneSegment x="122.14184002466344" y="9.956970147414477" width="6" />
            <laneSegment x="120.31523182097598" y="11.60277634620917" width="6" />
            <laneSegment x="118.67001012314692" y="14.009586226931043" width="6" />
            <laneSegment x="117.06113645688104" y="16.776441699887016" width="6" />
            <laneSegment x="115.30295796569618" y="19.46011382522721" width="6" />
            <laneSegment x="113.2301903134928" y="21.66571826619961" width="6" />
            <laneSegment x="110.75726821030432" y="23.134854256478267" width="6" />
            <laneSegment x="107.9096541882178" y="23.791201596595698" width="6" />
            <laneSegment x="104.8008916323731" y="23.70380658436213" width="6" />
            <laneSegment x="101.59348211775122" y="23.025827896375027" width="6" />
            <laneSegment x="98.45937979273644" y="21.932705995823266" width="6" />
            <laneSegment x="95.54231129564315" y="20.56492784740912" width="6" />
            <laneSegment x="92.93535140024444" y="19.00919398458576" width="6" />
            <laneSegment x="90.67588703785343" y="17.32335631777097" width="6" />
            <laneSegment x="88.74345103825414" y="15.568579717597316" width="6" />
            <laneSegment x="87.05765003369201" y="13.84140894939609" width="6" />
            <laneSegment x="85.48162854209744" y="12.295351162054258" width="6" />
            <laneSegment x="83.85031623612419" y="11.11552384798248" width="6" />
            <laneSegment x="82.01539241282181" y="10.461643679758966" width="6" />
            <laneSegment x="79.89166666666665" y="10.408333333333331" width="6" />
            <laneSegment x="77.50243679146564" y="10.886761751057417" width="6" />
            <laneSegment x="74.99823461357175" y="11.660991753040529" width="6" />
            <laneSegment x="72.60801811227498" y="12.392430917328465" width="6" />
            <laneSegment x="70.56375147150474" y="12.738989808406934" width="6" />
            <laneSegment x="69.02396398212568" y="12.455571935230086" width="6" />
            <laneSegment x="68.00170794758597" y="11.488735969765266" width="6" />
            <laneSegment x="67.34444346941058" y="10.002565945230193" width="6" />
            <laneSegment x="66.79090463288136" y="8.302557548099745" width="6" />
            <laneSegment x="66.04516214325483" y="6.736722787605576" width="6" />
            <laneSegment x="64.85086501452365" y="5.5964639574038095" width="6" />
            <laneSegment x="63.05723593964335" y="5.029355281207135" width="6" />
            <laneSegment x="60.63510006147119" y="5.024076327788507" width="6" />
            <laneSegment x="57.649075441974816" y="5.458647933683285" width="6" />
            <laneSegment x="54.22451774705999" y="6.156243038537177" width="6" />
            <laneSegment x="50.514586114543384" y="6.9407376131370455" width="6" />
            <laneSegment x="46.67290830089103" y="7.680630986796276" width="6" />
            <laneSegment x="42.845026662736394" y="8.293955366693263" width="6" />
            <laneSegment x="39.16955089795569" y="8.733022859735946" width="6" />
            <laneSegment x="35.779875854390355" y="8.967998763979498" width="6" />
            <laneSegment x="32.805727276003644" y="8.971020518759872" width="6" />
            <laneSegment x="30.371751581107134" y="8.709690535112292" width="6" />
            <laneSegment x="28.590386374028334" y="8.158705799420815" width="6" />
            <laneSegment x="27.553025826619116" y="7.316894736671207" width="6" />
            <laneSegment x="27.321148761365446" y="6.224376375082018" width="6" />
            <laneSegment x="27.918884079417435" y="4.9767923630511905" width="6" />
            <laneSegment x="29.337587883293324" y="3.7150772137372834" width="6" />
            <laneSegment x="31.554111447788443" y="2.587347187237908" width="6" />
            <laneSegment x="34.55132868216277" y="1.70618772702589" width="6" />
            <laneSegment x="38.33814685398005" y="1.1082208343092765" width="6" />
            <laneSegment x="42.93037211642412" y="0.8837752237788947" width="6" />
            <laneSegment x="48.156338173081494" y="2.068036312542734" width="6" />
            <laneSegment x="53.34433101965757" y="8.04584329402317" width="6" />
            <laneSegment x="57.0" y="26.0" width="6" />
        </lane>
    </lanes>
</environment>